{
  "schema_version": 1,
  "node_id": "reshape2d",
  "status": "stable",
  "generated": {
    "node_id": "reshape2d",
    "created_with": "reshape2d",
    "scene_path": "res://scenes/reshape.tscn",
    "scene_uid": "uid://b743v0abvh8r1",
    "root_instance_path": null,
    "script_path": "res://scripts/reshape.gd",
    "inheritance_chain": [
      "res://scripts/reshape.gd",
      "res://scripts/base_graph.gd"
    ],
    "inherits_graph": true,
    "server_typename": "Reshape2D",
    "layer_name": null,
    "title_candidates": {
      "en": "Reshape2D",
      "ru": "Переформ2D",
      "kz": "ПішінӨзгерту2D"
    },
    "base_config": {
      "columns": 0,
      "rows": 0
    },
    "ports": [
      {
        "id": "input_o2_layer_in",
        "scene_node": "o2",
        "scene_path": ".",
        "hint": 0,
        "server_name": "layer_in",
        "direction": "input",
        "datatypes": [
          "layer1d",
          "input1d"
        ],
        "multiple": false,
        "config_conn": false,
        "keyword": null,
        "conn_count_keyword": null
      },
      {
        "id": "output_o_layer_out",
        "scene_node": "o",
        "scene_path": ".",
        "hint": 0,
        "server_name": "layer_out",
        "direction": "output",
        "datatypes": [
          "layer2d"
        ],
        "multiple": true,
        "config_conn": false,
        "keyword": null,
        "conn_count_keyword": null
      }
    ],
    "settings": [
      {
        "id": "columns",
        "source": "base_config",
        "default": 0,
        "ui_kind": null,
        "ui_path": null,
        "options": []
      },
      {
        "id": "rows",
        "source": "base_config",
        "default": 0,
        "ui_kind": null,
        "ui_path": null,
        "options": []
      }
    ],
    "icon_source": "res://node_icons/IconReshape2d.png",
    "static_compatible_nodes": [
      {
        "from_port": "output_o_layer_out",
        "to_node": "flatten",
        "to_port": "input_o2_layer_in",
        "datatypes": [
          "layer2d"
        ],
        "confidence": "static_datatype_intersection"
      },
      {
        "from_port": "output_o_layer_out",
        "to_node": "conv2d",
        "to_port": "input_ni_layer_in",
        "datatypes": [
          "layer2d"
        ],
        "confidence": "static_datatype_intersection"
      },
      {
        "from_port": "output_o_layer_out",
        "to_node": "maxpool",
        "to_port": "input_ni_layer_in",
        "datatypes": [
          "layer2d"
        ],
        "confidence": "static_datatype_intersection"
      }
    ]
  },
  "docs": {
    "title": {
      "en": "Reshape2D",
      "ru": "Переформ2D",
      "kz": "ПішінӨзгерту2D"
    },
    "summary": {
      "en": "",
      "ru": "",
      "kz": ""
    },
    "operation": {
      "en": "",
      "ru": "",
      "kz": ""
    },
    "compact": {
      "body": {
        "en": "",
        "ru": "",
        "kz": ""
      }
    },
    "ports": {
      "input_o2_layer_in": {
        "label": {
          "en": "layer_in",
          "ru": "",
          "kz": ""
        },
        "description": {
          "en": "",
          "ru": "",
          "kz": ""
        }
      },
      "output_o_layer_out": {
        "label": {
          "en": "layer_out",
          "ru": "",
          "kz": ""
        },
        "description": {
          "en": "",
          "ru": "",
          "kz": ""
        }
      }
    },
    "settings": {
      "columns": {
        "label": {
          "en": "columns",
          "ru": "",
          "kz": ""
        },
        "description": {
          "en": "",
          "ru": "",
          "kz": ""
        }
      },
      "rows": {
        "label": {
          "en": "rows",
          "ru": "",
          "kz": ""
        },
        "description": {
          "en": "",
          "ru": "",
          "kz": ""
        }
      }
    },
    "connects_to": [],
    "examples": []
  }
}
