{
  "schema_version": 1,
  "node_id": "run_model",
  "status": "stable",
  "generated": {
    "node_id": "run_model",
    "created_with": "run_model",
    "scene_path": "res://scenes/run_model.tscn",
    "scene_uid": "uid://bajnadkdpiu3h",
    "root_instance_path": null,
    "script_path": "res://scripts/run_m.gd",
    "inheritance_chain": [
      "res://scripts/run_m.gd",
      "res://scripts/io_graph.gd",
      "res://scripts/base_graph.gd"
    ],
    "inherits_graph": true,
    "server_typename": "RunModel",
    "layer_name": null,
    "title_candidates": {
      "en": "RunModel",
      "ru": "ЗапускМодели",
      "kz": "МодельОрын"
    },
    "base_config": {
      "branches": "{}",
      "mapped": "{}"
    },
    "ports": [
      {
        "id": "input_o2_runmodel",
        "scene_node": "o2",
        "scene_path": ".",
        "hint": 1,
        "server_name": "RunModel",
        "direction": "input",
        "datatypes": [
          "netname"
        ],
        "multiple": false,
        "config_conn": true,
        "keyword": null,
        "conn_count_keyword": "netname"
      },
      {
        "id": "input_i2_model_in",
        "scene_node": "i2",
        "scene_path": ".",
        "hint": 0,
        "server_name": "model_in",
        "direction": "input",
        "datatypes": [
          "data"
        ],
        "multiple": false,
        "config_conn": false,
        "keyword": null,
        "conn_count_keyword": "train"
      },
      {
        "id": "output_i_model_out",
        "scene_node": "i",
        "scene_path": ".",
        "hint": 0,
        "server_name": "model_out",
        "direction": "output",
        "datatypes": [
          "model_output"
        ],
        "multiple": false,
        "config_conn": false,
        "keyword": null,
        "conn_count_keyword": "train"
      },
      {
        "id": "output_connection_i_model_out",
        "scene_node": "i",
        "scene_path": "connection",
        "hint": 4,
        "server_name": "model_out",
        "direction": "output",
        "datatypes": [
          "pellet"
        ],
        "multiple": false,
        "config_conn": false,
        "keyword": null,
        "conn_count_keyword": "pell"
      }
    ],
    "settings": [
      {
        "id": "branches",
        "source": "base_config",
        "default": "{}",
        "ui_kind": null,
        "ui_path": null,
        "options": []
      },
      {
        "id": "mapped",
        "source": "base_config",
        "default": "{}",
        "ui_kind": null,
        "ui_path": null,
        "options": []
      }
    ],
    "icon_source": "res://node_icons/IconRunModel.png",
    "static_compatible_nodes": [
      {
        "from_port": "output_i_model_out",
        "to_node": "output_map",
        "to_port": "input_i2_model_in",
        "datatypes": [
          "model_output"
        ],
        "confidence": "static_datatype_intersection"
      },
      {
        "from_port": "output_i_model_out",
        "to_node": "train_rl",
        "to_port": "input_i_pred_in",
        "datatypes": [
          "model_output"
        ],
        "confidence": "static_datatype_intersection"
      },
      {
        "from_port": "output_connection_i_model_out",
        "to_node": "output_map",
        "to_port": "input_connection_i_model_out",
        "datatypes": [
          "pellet"
        ],
        "confidence": "static_datatype_intersection"
      }
    ]
  },
  "docs": {
    "title": {
      "en": "RunModel",
      "ru": "ЗапускМодели",
      "kz": "МодельОрын"
    },
    "summary": {
      "en": "",
      "ru": "",
      "kz": ""
    },
    "operation": {
      "en": "",
      "ru": "",
      "kz": ""
    },
    "compact": {
      "body": {
        "en": "",
        "ru": "",
        "kz": ""
      }
    },
    "ports": {
      "input_o2_runmodel": {
        "label": {
          "en": "RunModel",
          "ru": "",
          "kz": ""
        },
        "description": {
          "en": "",
          "ru": "",
          "kz": ""
        }
      },
      "input_i2_model_in": {
        "label": {
          "en": "model_in",
          "ru": "",
          "kz": ""
        },
        "description": {
          "en": "",
          "ru": "",
          "kz": ""
        }
      },
      "output_i_model_out": {
        "label": {
          "en": "model_out",
          "ru": "",
          "kz": ""
        },
        "description": {
          "en": "",
          "ru": "",
          "kz": ""
        }
      },
      "output_connection_i_model_out": {
        "label": {
          "en": "model_out",
          "ru": "",
          "kz": ""
        },
        "description": {
          "en": "",
          "ru": "",
          "kz": ""
        }
      }
    },
    "settings": {
      "branches": {
        "label": {
          "en": "branches",
          "ru": "",
          "kz": ""
        },
        "description": {
          "en": "",
          "ru": "",
          "kz": ""
        }
      },
      "mapped": {
        "label": {
          "en": "mapped",
          "ru": "",
          "kz": ""
        },
        "description": {
          "en": "",
          "ru": "",
          "kz": ""
        }
      }
    },
    "connects_to": [],
    "examples": []
  }
}
