{
  "schema_version": 1,
  "node_id": "output_map",
  "status": "stable",
  "generated": {
    "node_id": "output_map",
    "created_with": "output_map",
    "scene_path": "res://scenes/branch_mapping.tscn",
    "scene_uid": "uid://tl4ael3dfb7d",
    "root_instance_path": null,
    "script_path": "res://scripts/branches.gd",
    "inheritance_chain": [
      "res://scripts/branches.gd",
      "res://scripts/io_graph.gd",
      "res://scripts/base_graph.gd"
    ],
    "inherits_graph": true,
    "server_typename": "OutputMap",
    "layer_name": null,
    "title_candidates": {
      "en": "OutputMap",
      "ru": "КартаВывода",
      "kz": "ШығысКартасы"
    },
    "base_config": {},
    "ports": [
      {
        "id": "input_i2_model_in",
        "scene_node": "i2",
        "scene_path": ".",
        "hint": 0,
        "server_name": "model_in",
        "direction": "input",
        "datatypes": [
          "model_output"
        ],
        "multiple": false,
        "config_conn": false,
        "keyword": null,
        "conn_count_keyword": "train"
      },
      {
        "id": "output_i_model_out",
        "scene_node": "i",
        "scene_path": ".",
        "hint": 0,
        "server_name": "model_out",
        "direction": "output",
        "datatypes": [
          "output_mapped"
        ],
        "multiple": false,
        "config_conn": false,
        "keyword": null,
        "conn_count_keyword": "train"
      },
      {
        "id": "input_connection_i_model_out",
        "scene_node": "i",
        "scene_path": "connection",
        "hint": 4,
        "server_name": "model_out",
        "direction": "input",
        "datatypes": [
          "pellet"
        ],
        "multiple": false,
        "config_conn": false,
        "keyword": null,
        "conn_count_keyword": "pell"
      }
    ],
    "settings": [],
    "icon_source": "res://node_icons/IconOutputMap.png",
    "static_compatible_nodes": [
      {
        "from_port": "output_i_model_out",
        "to_node": "train_input",
        "to_port": "input_i_pred_in",
        "datatypes": [
          "output_mapped"
        ],
        "confidence": "static_datatype_intersection"
      }
    ]
  },
  "docs": {
    "title": {
      "en": "OutputMap",
      "ru": "КартаВывода",
      "kz": "ШығысКартасы"
    },
    "summary": {
      "en": "",
      "ru": "",
      "kz": ""
    },
    "operation": {
      "en": "",
      "ru": "",
      "kz": ""
    },
    "compact": {
      "body": {
        "en": "",
        "ru": "",
        "kz": ""
      }
    },
    "ports": {
      "input_i2_model_in": {
        "label": {
          "en": "model_in",
          "ru": "",
          "kz": ""
        },
        "description": {
          "en": "",
          "ru": "",
          "kz": ""
        }
      },
      "output_i_model_out": {
        "label": {
          "en": "model_out",
          "ru": "",
          "kz": ""
        },
        "description": {
          "en": "",
          "ru": "",
          "kz": ""
        }
      },
      "input_connection_i_model_out": {
        "label": {
          "en": "model_out",
          "ru": "",
          "kz": ""
        },
        "description": {
          "en": "",
          "ru": "",
          "kz": ""
        }
      }
    },
    "settings": {},
    "connects_to": [],
    "examples": []
  }
}
