{
  "schema_version": 1,
  "node_id": "model_name",
  "status": "stable",
  "generated": {
    "node_id": "model_name",
    "created_with": "model_name",
    "scene_path": "res://scenes/netname.tscn",
    "scene_uid": "uid://wav7n44fxbkf",
    "root_instance_path": null,
    "script_path": "res://scripts/netname.gd",
    "inheritance_chain": [
      "res://scripts/netname.gd",
      "res://scripts/base_graph.gd"
    ],
    "inherits_graph": true,
    "server_typename": "ModelName",
    "layer_name": null,
    "title_candidates": {
      "en": "Model",
      "ru": "ИмяМодели",
      "kz": "МодельАтауы"
    },
    "base_config": {
      "name": ""
    },
    "ports": [
      {
        "id": "output_o2_netname",
        "scene_node": "o2",
        "scene_path": ".",
        "hint": 0,
        "server_name": "netname",
        "direction": "output",
        "datatypes": [
          "netname"
        ],
        "multiple": true,
        "config_conn": false,
        "keyword": null,
        "conn_count_keyword": null
      }
    ],
    "settings": [
      {
        "id": "name",
        "source": "base_config",
        "default": "",
        "ui_kind": "instance",
        "ui_path": "LineEdit",
        "options": []
      }
    ],
    "icon_source": "res://node_icons/IconModelName.png",
    "static_compatible_nodes": [
      {
        "from_port": "output_o2_netname",
        "to_node": "input",
        "to_port": "input_o2_runmodel",
        "datatypes": [
          "netname"
        ],
        "confidence": "static_datatype_intersection"
      },
      {
        "from_port": "output_o2_netname",
        "to_node": "run_model",
        "to_port": "input_o2_runmodel",
        "datatypes": [
          "netname"
        ],
        "confidence": "static_datatype_intersection"
      },
      {
        "from_port": "output_o2_netname",
        "to_node": "input_1d",
        "to_port": "input_o2_runmodel",
        "datatypes": [
          "netname"
        ],
        "confidence": "static_datatype_intersection"
      }
    ]
  },
  "docs": {
    "title": {
      "en": "Model",
      "ru": "ИмяМодели",
      "kz": "МодельАтауы"
    },
    "summary": {
      "en": "",
      "ru": "",
      "kz": ""
    },
    "operation": {
      "en": "",
      "ru": "",
      "kz": ""
    },
    "compact": {
      "body": {
        "en": "",
        "ru": "",
        "kz": ""
      }
    },
    "ports": {
      "output_o2_netname": {
        "label": {
          "en": "netname",
          "ru": "",
          "kz": ""
        },
        "description": {
          "en": "",
          "ru": "",
          "kz": ""
        }
      }
    },
    "settings": {
      "name": {
        "label": {
          "en": "name",
          "ru": "",
          "kz": ""
        },
        "description": {
          "en": "",
          "ru": "",
          "kz": ""
        }
      }
    },
    "connects_to": [],
    "examples": []
  }
}
