{
  "schema_version": 1,
  "node_id": "train_begin",
  "status": "stable",
  "generated": {
    "node_id": "train_begin",
    "created_with": "train_begin",
    "scene_path": "res://scenes/train_begin.tscn",
    "scene_uid": "uid://274a5p56vhfv",
    "root_instance_path": null,
    "script_path": "res://scripts/train_begin.gd",
    "inheritance_chain": [
      "res://scripts/train_begin.gd",
      "res://scripts/base_graph.gd"
    ],
    "inherits_graph": true,
    "server_typename": "TrainBegin",
    "layer_name": null,
    "title_candidates": {
      "en": "TrainBegin",
      "ru": "НачОбучения",
      "kz": "ОқытуБастау"
    },
    "base_config": {},
    "ports": [
      {
        "id": "input_o2_netname",
        "scene_node": "o2",
        "scene_path": ".",
        "hint": 0,
        "server_name": "netname",
        "direction": "input",
        "datatypes": [
          "dataset_type"
        ],
        "multiple": false,
        "config_conn": true,
        "keyword": null,
        "conn_count_keyword": "netname"
      },
      {
        "id": "output_i_input_out",
        "scene_node": "i",
        "scene_path": ".",
        "hint": 0,
        "server_name": "input_out",
        "direction": "output",
        "datatypes": [
          "data"
        ],
        "multiple": false,
        "config_conn": false,
        "keyword": null,
        "conn_count_keyword": "train"
      }
    ],
    "settings": [],
    "icon_source": "res://node_icons/IconTrainBegin.png",
    "static_compatible_nodes": [
      {
        "from_port": "output_i_input_out",
        "to_node": "run_model",
        "to_port": "input_i2_model_in",
        "datatypes": [
          "data"
        ],
        "confidence": "static_datatype_intersection"
      }
    ]
  },
  "docs": {
    "title": {
      "en": "TrainBegin",
      "ru": "НачОбучения",
      "kz": "ОқытуБастау"
    },
    "summary": {
      "en": "",
      "ru": "",
      "kz": ""
    },
    "operation": {
      "en": "",
      "ru": "",
      "kz": ""
    },
    "compact": {
      "body": {
        "en": "",
        "ru": "",
        "kz": ""
      }
    },
    "ports": {
      "input_o2_netname": {
        "label": {
          "en": "netname",
          "ru": "",
          "kz": ""
        },
        "description": {
          "en": "",
          "ru": "",
          "kz": ""
        }
      },
      "output_i_input_out": {
        "label": {
          "en": "input_out",
          "ru": "",
          "kz": ""
        },
        "description": {
          "en": "",
          "ru": "",
          "kz": ""
        }
      }
    },
    "settings": {},
    "connects_to": [],
    "examples": []
  }
}
