{
  "schema_version": 1,
  "node_id": "maxpool",
  "status": "stable",
  "generated": {
    "node_id": "maxpool",
    "created_with": "maxpool",
    "scene_path": "res://scenes/maxpool.tscn",
    "scene_uid": "uid://ctesghfdkge1l",
    "root_instance_path": null,
    "script_path": "res://scripts/maxpool.gd",
    "inheritance_chain": [
      "res://scripts/maxpool.gd",
      "res://scripts/conv_2d.gd",
      "res://scripts/base_layer.gd",
      "res://scripts/io_graph.gd",
      "res://scripts/base_graph.gd"
    ],
    "inherits_graph": true,
    "server_typename": "NeuronLayer",
    "layer_name": "MaxPool2D",
    "title_candidates": {
      "en": "MaxPool2D",
      "ru": "МаксПул2D",
      "kz": "МаксПул2D"
    },
    "base_config": {
      "group": 2
    },
    "ports": [
      {
        "id": "input_ni_layer_in",
        "scene_node": "ni",
        "scene_path": ".",
        "hint": 1,
        "server_name": "layer_in",
        "direction": "input",
        "datatypes": [
          "layer2d"
        ],
        "multiple": true,
        "config_conn": false,
        "keyword": null,
        "conn_count_keyword": "layer"
      },
      {
        "id": "output_o_layer_out",
        "scene_node": "o",
        "scene_path": ".",
        "hint": 0,
        "server_name": "layer_out",
        "direction": "output",
        "datatypes": [
          "layer2d"
        ],
        "multiple": true,
        "config_conn": false,
        "keyword": null,
        "conn_count_keyword": "layer"
      }
    ],
    "settings": [
      {
        "id": "group",
        "source": "base_config",
        "default": 2,
        "ui_kind": null,
        "ui_path": null,
        "options": []
      }
    ],
    "icon_source": "res://node_icons/IconMaxpool.png",
    "static_compatible_nodes": [
      {
        "from_port": "output_o_layer_out",
        "to_node": "flatten",
        "to_port": "input_o2_layer_in",
        "datatypes": [
          "layer2d"
        ],
        "confidence": "static_datatype_intersection"
      },
      {
        "from_port": "output_o_layer_out",
        "to_node": "conv2d",
        "to_port": "input_ni_layer_in",
        "datatypes": [
          "layer2d"
        ],
        "confidence": "static_datatype_intersection"
      },
      {
        "from_port": "output_o_layer_out",
        "to_node": "maxpool",
        "to_port": "input_ni_layer_in",
        "datatypes": [
          "layer2d"
        ],
        "confidence": "static_datatype_intersection"
      }
    ]
  },
  "docs": {
    "title": {
      "en": "MaxPool2D",
      "ru": "МаксПул2D",
      "kz": "МаксПул2D"
    },
    "summary": {
      "en": "",
      "ru": "",
      "kz": ""
    },
    "operation": {
      "en": "",
      "ru": "",
      "kz": ""
    },
    "compact": {
      "body": {
        "en": "",
        "ru": "",
        "kz": ""
      }
    },
    "ports": {
      "input_ni_layer_in": {
        "label": {
          "en": "layer_in",
          "ru": "",
          "kz": ""
        },
        "description": {
          "en": "",
          "ru": "",
          "kz": ""
        }
      },
      "output_o_layer_out": {
        "label": {
          "en": "layer_out",
          "ru": "",
          "kz": ""
        },
        "description": {
          "en": "",
          "ru": "",
          "kz": ""
        }
      }
    },
    "settings": {
      "group": {
        "label": {
          "en": "group",
          "ru": "",
          "kz": ""
        },
        "description": {
          "en": "",
          "ru": "",
          "kz": ""
        }
      }
    },
    "connects_to": [],
    "examples": []
  }
}
