{
  "schema_version": 1,
  "node_id": "train_rl",
  "status": "stable",
  "generated": {
    "node_id": "train_rl",
    "created_with": "train_rl",
    "scene_path": "res://scenes/train_rl.tscn",
    "scene_uid": "uid://ftmeipklcuh3",
    "root_instance_path": null,
    "script_path": "res://scripts/train_rl.gd",
    "inheritance_chain": [
      "res://scripts/train_rl.gd",
      "res://scripts/base_graph.gd"
    ],
    "inherits_graph": true,
    "server_typename": "TrainRL",
    "layer_name": null,
    "title_candidates": {
      "en": "RLStep",
      "ru": "",
      "kz": ""
    },
    "base_config": {
      "lr": 0,
      "momentum": 0.0,
      "optimizer": "adam"
    },
    "ports": [
      {
        "id": "input_i_pred_in",
        "scene_node": "i",
        "scene_path": ".",
        "hint": 0,
        "server_name": "pred_in",
        "direction": "input",
        "datatypes": [
          "model_output"
        ],
        "multiple": true,
        "config_conn": false,
        "keyword": null,
        "conn_count_keyword": "train"
      }
    ],
    "settings": [
      {
        "id": "lr",
        "source": "base_config",
        "default": 0,
        "ui_kind": "instance",
        "ui_path": "lr",
        "options": [
          {
            "hint": "0",
            "text": "1e-1"
          },
          {
            "hint": "1",
            "text": "1e-2"
          },
          {
            "hint": "2",
            "text": "1e-3"
          }
        ]
      },
      {
        "id": "momentum",
        "source": "base_config",
        "default": 0.0,
        "ui_kind": null,
        "ui_path": null,
        "options": []
      },
      {
        "id": "optimizer",
        "source": "base_config",
        "default": "adam",
        "ui_kind": "instance",
        "ui_path": "optimizer",
        "options": [
          {
            "hint": "sgd",
            "text": "SGD"
          },
          {
            "hint": "adam",
            "text": "Adam"
          }
        ]
      }
    ],
    "icon_source": "res://node_icons/IconTrainRl.png",
    "static_compatible_nodes": []
  },
  "docs": {
    "title": {
      "en": "RLStep",
      "ru": "",
      "kz": ""
    },
    "summary": {
      "en": "",
      "ru": "",
      "kz": ""
    },
    "operation": {
      "en": "",
      "ru": "",
      "kz": ""
    },
    "compact": {
      "body": {
        "en": "",
        "ru": "",
        "kz": ""
      }
    },
    "ports": {
      "input_i_pred_in": {
        "label": {
          "en": "pred_in",
          "ru": "",
          "kz": ""
        },
        "description": {
          "en": "",
          "ru": "",
          "kz": ""
        }
      }
    },
    "settings": {
      "lr": {
        "label": {
          "en": "lr",
          "ru": "",
          "kz": ""
        },
        "description": {
          "en": "",
          "ru": "",
          "kz": ""
        }
      },
      "momentum": {
        "label": {
          "en": "momentum",
          "ru": "",
          "kz": ""
        },
        "description": {
          "en": "",
          "ru": "",
          "kz": ""
        }
      },
      "optimizer": {
        "label": {
          "en": "optimizer",
          "ru": "",
          "kz": ""
        },
        "description": {
          "en": "",
          "ru": "",
          "kz": ""
        }
      }
    },
    "connects_to": [],
    "examples": []
  }
}
