{
  "schema_version": 1,
  "node_id": "dropout",
  "status": "stable",
  "generated": {
    "node_id": "dropout",
    "created_with": "dropout",
    "scene_path": "res://scenes/dropout.tscn",
    "scene_uid": "uid://6tgq6ifq5dbw",
    "root_instance_path": null,
    "script_path": "res://scripts/dropout.gd",
    "inheritance_chain": [
      "res://scripts/dropout.gd",
      "res://scripts/base_layer.gd",
      "res://scripts/io_graph.gd",
      "res://scripts/base_graph.gd"
    ],
    "inherits_graph": true,
    "server_typename": "NeuronLayer",
    "layer_name": "Dropout",
    "title_candidates": {
      "en": "Dropout",
      "ru": "Дропаут",
      "kz": "Дропаут"
    },
    "base_config": {
      "p": 0.0
    },
    "ports": [
      {
        "id": "input_o2_layer_in",
        "scene_node": "o2",
        "scene_path": ".",
        "hint": 0,
        "server_name": "layer_in",
        "direction": "input",
        "datatypes": [
          "layer1d"
        ],
        "multiple": false,
        "config_conn": false,
        "keyword": null,
        "conn_count_keyword": null
      },
      {
        "id": "output_o_layer_out",
        "scene_node": "o",
        "scene_path": ".",
        "hint": 0,
        "server_name": "layer_out",
        "direction": "output",
        "datatypes": [
          "layer1d"
        ],
        "multiple": false,
        "config_conn": false,
        "keyword": null,
        "conn_count_keyword": null
      }
    ],
    "settings": [
      {
        "id": "p",
        "source": "base_config",
        "default": 0.0,
        "ui_kind": null,
        "ui_path": null,
        "options": []
      }
    ],
    "icon_source": "res://node_icons/IconDropout.png",
    "static_compatible_nodes": [
      {
        "from_port": "output_o_layer_out",
        "to_node": "layer",
        "to_port": "input_ni_layer_in",
        "datatypes": [
          "layer1d"
        ],
        "confidence": "static_datatype_intersection"
      },
      {
        "from_port": "output_o_layer_out",
        "to_node": "softmax",
        "to_port": "input_o2_layer_in",
        "datatypes": [
          "layer1d"
        ],
        "confidence": "static_datatype_intersection"
      },
      {
        "from_port": "output_o_layer_out",
        "to_node": "reshape2d",
        "to_port": "input_o2_layer_in",
        "datatypes": [
          "layer1d"
        ],
        "confidence": "static_datatype_intersection"
      },
      {
        "from_port": "output_o_layer_out",
        "to_node": "classifier",
        "to_port": "input_ni_layer_in",
        "datatypes": [
          "layer1d"
        ],
        "confidence": "static_datatype_intersection"
      },
      {
        "from_port": "output_o_layer_out",
        "to_node": "dropout",
        "to_port": "input_o2_layer_in",
        "datatypes": [
          "layer1d"
        ],
        "confidence": "static_datatype_intersection"
      },
      {
        "from_port": "output_o_layer_out",
        "to_node": "concat",
        "to_port": "input_connection_o_layer_in",
        "datatypes": [
          "layer1d"
        ],
        "confidence": "static_datatype_intersection"
      }
    ]
  },
  "docs": {
    "title": {
      "en": "Dropout",
      "ru": "Дропаут",
      "kz": "Дропаут"
    },
    "summary": {
      "en": "",
      "ru": "",
      "kz": ""
    },
    "operation": {
      "en": "",
      "ru": "",
      "kz": ""
    },
    "compact": {
      "body": {
        "en": "",
        "ru": "",
        "kz": ""
      }
    },
    "ports": {
      "input_o2_layer_in": {
        "label": {
          "en": "layer_in",
          "ru": "",
          "kz": ""
        },
        "description": {
          "en": "",
          "ru": "",
          "kz": ""
        }
      },
      "output_o_layer_out": {
        "label": {
          "en": "layer_out",
          "ru": "",
          "kz": ""
        },
        "description": {
          "en": "",
          "ru": "",
          "kz": ""
        }
      }
    },
    "settings": {
      "p": {
        "label": {
          "en": "p",
          "ru": "",
          "kz": ""
        },
        "description": {
          "en": "",
          "ru": "",
          "kz": ""
        }
      }
    },
    "connects_to": [],
    "examples": []
  }
}
