{
  "schema_version": 1,
  "node_id": "input_1d",
  "status": "stable",
  "generated": {
    "node_id": "input_1d",
    "created_with": "input_1d",
    "scene_path": "res://scenes/input_1d.tscn",
    "scene_uid": "uid://coifi5ok0t7lo",
    "root_instance_path": null,
    "script_path": "res://scripts/input_1d.gd",
    "inheritance_chain": [
      "res://scripts/input_1d.gd",
      "res://scripts/io_graph.gd",
      "res://scripts/base_graph.gd"
    ],
    "inherits_graph": true,
    "server_typename": "InputNode",
    "layer_name": null,
    "title_candidates": {
      "en": "Input1D",
      "ru": "Ввод1D",
      "kz": "Кіріс1D"
    },
    "base_config": {
      "input_features": "[]"
    },
    "ports": [
      {
        "id": "input_o2_runmodel",
        "scene_node": "o2",
        "scene_path": ".",
        "hint": 1,
        "server_name": "RunModel",
        "direction": "input",
        "datatypes": [
          "netname"
        ],
        "multiple": false,
        "config_conn": true,
        "keyword": null,
        "conn_count_keyword": "netname"
      },
      {
        "id": "output_o_input_out",
        "scene_node": "o",
        "scene_path": ".",
        "hint": 0,
        "server_name": "input_out",
        "direction": "output",
        "datatypes": [
          "input1d"
        ],
        "multiple": true,
        "config_conn": false,
        "keyword": null,
        "conn_count_keyword": null
      }
    ],
    "settings": [
      {
        "id": "input_features",
        "source": "base_config",
        "default": "[]",
        "ui_kind": null,
        "ui_path": null,
        "options": []
      },
      {
        "id": "title",
        "source": "script",
        "default": null,
        "ui_kind": null,
        "ui_path": null,
        "options": []
      }
    ],
    "icon_source": "res://node_icons/IconInput1d.png",
    "static_compatible_nodes": [
      {
        "from_port": "output_o_input_out",
        "to_node": "layer",
        "to_port": "input_ni_layer_in",
        "datatypes": [
          "input1d"
        ],
        "confidence": "static_datatype_intersection"
      },
      {
        "from_port": "output_o_input_out",
        "to_node": "reshape2d",
        "to_port": "input_o2_layer_in",
        "datatypes": [
          "input1d"
        ],
        "confidence": "static_datatype_intersection"
      }
    ]
  },
  "docs": {
    "title": {
      "en": "Input1D",
      "ru": "Ввод1D",
      "kz": "Кіріс1D"
    },
    "summary": {
      "en": "",
      "ru": "",
      "kz": ""
    },
    "operation": {
      "en": "",
      "ru": "",
      "kz": ""
    },
    "compact": {
      "body": {
        "en": "",
        "ru": "",
        "kz": ""
      }
    },
    "ports": {
      "input_o2_runmodel": {
        "label": {
          "en": "RunModel",
          "ru": "",
          "kz": ""
        },
        "description": {
          "en": "",
          "ru": "",
          "kz": ""
        }
      },
      "output_o_input_out": {
        "label": {
          "en": "input_out",
          "ru": "",
          "kz": ""
        },
        "description": {
          "en": "",
          "ru": "",
          "kz": ""
        }
      }
    },
    "settings": {
      "input_features": {
        "label": {
          "en": "input_features",
          "ru": "",
          "kz": ""
        },
        "description": {
          "en": "",
          "ru": "",
          "kz": ""
        }
      },
      "title": {
        "label": {
          "en": "title",
          "ru": "",
          "kz": ""
        },
        "description": {
          "en": "",
          "ru": "",
          "kz": ""
        }
      }
    },
    "connects_to": [],
    "examples": []
  }
}
